{
  "$schema": "../../../CARRIER/SCHEMAS/regulation-index.schema.json",
  "schema": "local-reality-body.regulation-index.v0.1",
  "body_id": "RM-LOCAL-REALITY-BODY-001",
  "represented_currentness_revision": 8,
  "records": [
    {
      "record_id": "RM-LOCAL-REALITY-BODY-001-REGULATION-001",
      "carrier": "BODY/METABOLISM/REGULATION/RECORDS/REGULATION_001.json",
      "sha256": "4efebb1ea32d7cf794193c45cd11e7c8f12c157997ab8a459f9735585dca6a20",
      "matter_record_id": "RM-LOCAL-REALITY-BODY-001-MATTER-001",
      "local_record_posture": "ADMITTED_BODY_LOCAL_MATTER",
      "progression_posture": "HELD",
      "locus_assessment": "WITHIN_SUPPORTED_LOCUS",
      "law_compatibility_assessment": "UNASSESSED",
      "evidence_posture": "PARTIAL",
      "authority_presentation": "NOT_PRESENTED"
    }
  ],
  "record_count": 1,
  "mechanism_present": false,
  "explicit_non_effects": [
    "NO_SOVEREIGN_REGULATION_LAYER",
    "NO_NORMATIVE_THRESHOLD_CREATION",
    "NO_AUTHORITY_OR_ACT_ORIGINATION",
    "NO_OCCURRENCE_OR_CURRENTNESS_CREATION",
    "NO_REGULATION_MECHANISM_ADMISSION_OR_ACTIVATION",
    "NO_FORCED_PROGRESSION_OR_SILENT_DISCARD",
    "NO_PROGRESSION_RELEASE_PRESENTATION_OR_OPERATIONALIZATION",
    "NO_CONSEQUENCE_OR_EPISTEMIC_UPTAKE"
  ]
}
